was interrogated by a CIA agent,Experienced Directly (ED),Non-Traumatic,Moderate,Threat to moral identity
hallucinated while under the influence of a drug,Experienced Directly (ED),Traumatic,High,Threat to moral identity
became impoverished after moving to a foreign country,Experienced Directly (ED),Traumatic,High,Threat to social status or other identity 
had a mild allergic reaction to pollen,Experienced Directly (ED),Traumatic,High,Health/Medical
was beaten until unconscious,Experienced Directly (ED),Traumatic,High,Human perpetrator
was choked by a family member,Experienced Directly (ED),Traumatic,High,Close interpersonal perpetrator
lost a foot in a shark attack,Experienced Directly (ED),Traumatic,High,Actual physical injury
vomited in a public place,Experienced Directly (ED),Non-Traumatic,Low,Threat to social status or other identity
discovered that a home was wiretapped,Learned About (LA) ,Traumatic,Moderate,Threat to moral worldview
was deployed in a combat unit,Experienced Directly (ED),Traumatic,Moderate,Threat of physical injury
lifted weights,Experienced Directly (ED),Non-Traumatic,Low,Miscellaneous
learned about genocide in a college course,Learned About (LA),Traumatic,Moderate,Threat to moral worldview
help move a piano into a moving truck,Experienced Directly (ED),Non-Traumatic,Low,Miscellaneous
cracked his/her knuckles,Experienced Directly (ED),Non-Traumatic,Low,Miscellaneous
smelled a rotting animal carcass,Experienced Directly (ED),Traumatic,Moderate,Actual death
nearly suffocated due to an allergic reaction,Experienced Directly (ED),Traumatic,High,Threat of death
was abandoned by a romantic partner,Experienced Directly (ED),Traumatic,High,Threat to trust in interpersonal relationships
killed an adult pedestrian while driving,Experienced Directly (ED),Traumatic,High,Actual death
made a cup of tea,Experienced Directly (ED),Non-Traumatic,Low,Miscellaneous
witnessed a father develop Alzheimer's disease,Witnessed (W),Traumatic,High,Close interpersonal victim
was chased by an angry dog,Experienced Directly (ED),Traumatic,High,Threat of physical injury
witnessed a stranger die from a heart attack while working as an emergency medical technician (EMT),Witnessed (W),Traumatic,High,Actual death
was threatened with rape by a family member,Experienced Directly (ED),Traumatic,High,Sexual content
witnessed a friend being shot and killed,Witnessed (W),Traumatic,High,Actual death
accidentally shot and killed a friend during warfare,Experienced Directly (ED),Traumatic,High,Actual death
lost a finger in a work-related accident,Experienced Directly (ED),Traumatic,High,Actual physical injury
had a photo taken at a family event,Experienced Directly (ED),Non-Traumatic,Low,Miscellaneous
witnessed two strangers talking,Witnessed (W),Traumatic,Low,Miscellaneous
was not interviewed after sending out many job applications,Experienced Directly (ED),Non-Traumatic,Low,Miscellaneous 
read a celebrity magazine,Witnessed (W) ,Non-Traumatic,Low,Miscellaneous
watched a video of strangers dying during 9/11,Witnessed (W),Traumatic,High,Actual death
was rejected by a potential love interest,Experienced Directly (ED),Non-Traumatic,Low,Threat to social status or other identity
witnessed a stranger die by suicide with a gun,Witnessed (W),Traumatic,High,Actual death
cut and filed fingernails,Experienced Directly (ED),Non-Traumatic,Low,Miscellaneous
lost 15 pounds,Experienced Directly (ED),Non-Traumatic,Low,Health/Medical
played BINGO,Experienced Directly (ED),Non-Traumatic,Low,Miscellaneous
watched late-night television,Witnessed (W),Non-Traumatic,Low,Miscellaneous
was shot at with a gun,Experienced Directly (ED),Traumatic,High,Threat of death
was hit in the face accidentally by a friend,Experienced Directly (ED),Non-Traumatic,Low,Close interpersonal perpetrator
sketched a portrait of a friend,Experienced Directly (ED),Non-Traumatic,Low,Miscellaneous
witnessed a stranger being hit by a car and injured,Witnessed (W),Traumatic,High,Actual physical injury
was pushed by a friend,Experienced Directly (ED),Non-Traumatic,Low,Physical pain
was barked at by a dog,Experienced Directly (ED),Non-Traumatic,Low,Miscellaneous
witnessed a son being forcibly arrested,Witnessed (W),Traumatic,High,Human perpetrator
was denied a visa by an immigration office,Experienced Directly (ED),Non-Traumatic,Low,Miscellaneous
was slapped in the face by a father,Experienced Directly (ED),Traumatic,High,Close interpersonal perpetrator
attended a political speech he/she disagreed with,Experienced Directly (ED),Non-Traumatic,Low,Threat to moral worldview
watched a video of a man being beat until unconscious,Witnessed (W) ,Traumatic,High,Actual physical injury
read a political article with his/her opposite opinion,Learned About (LA) ,Non-Traumatic,Low,Miscellaneous
lost a child due to a terminal illness,Experienced Directly (ED),Traumatic,High,Actual death
witnessed a friend being punched,Witnessed (W),Non-Traumatic,Moderate,Actual physical injury
went for a hike,Experienced Directly (ED),Non-Traumatic,Low,Miscellaneous
learned about a family member getting a promotion,Learned About (LA),Non-Traumatic,Low,Miscellaneous
witnessed a corpse unexpectedly in the street,Witnessed (W),Traumatic,High,Actual death
tried a new food and found it delicious,Experienced Directly (ED),Non-Traumatic,Low,Miscellaneous
witnessed strangers die from blood loss while working as an emergency medical technician (EMT),Witnessed (W),Traumatic,High,Actual death