witnessed a stranger die from cancer,Witnessed (W),Traumatic,High,Actual death
witnessed a child being killed in an IED explosion,Witnessed (W),Traumatic,High,Actual death
ate an apple,Experienced Directly (ED),Non-Traumatic,Low,Miscellaneous 
witnessed a mother die from cancer,Witnessed (W),Traumatic,High,Close interpersonal victim
was hit with a baseball bat,Experienced Directly (ED),Traumatic,Moderate,Physical pain
took a long nap,Experienced Directly (ED),Non-Traumatic,Low,Miscellaneous 
learned about a daughter working as a prostitute,Learned About (LA),Non-Traumatic,Low,Miscellaneous
was paralyzed from the neck down due to a work-related accident,Experienced Directly (ED),Traumatic,High,Actual physical injury
was burned in a kitchen fire,Experienced Directly (ED),Traumatic,High,Physical pain
was slandered on national TV,Experienced Directly (ED),Traumatic,Moderate,Threat to social status or other identity
rode a rollercoaster,Experienced Directly (ED),Non-Traumatic,Low,Miscellaneous 
slept late on a weekend,Experienced Directly (ED),Non-Traumatic,Low,Miscellaneous 
accidentally used a family member's toothbrush,Experienced Directly (ED),Non-Traumatic,Low,Miscellaneous
overslept and arrived late for work,Experienced Directly (ED),Non-Traumatic,Low,Threat to moral identity
filled up a car at a gas station,Experienced Directly (ED),Non-Traumatic,Low,Miscellaneous 
became paralyzed below the neck while practicing martial arts,Experienced Directly (ED),Traumatic,High,Actual physical injury 
was publicly spanked by a teacher,Experienced Directly (ED),Traumatic,High,Threat to social status or other identity
read a textbook on sociology,Experienced Directly (ED),Non-Traumatic,Low,Miscellaneous
took public transportation,Experienced Directly (ED),Non-Traumatic,Low,Miscellaneous 
was stung by a bee,Experienced Directly (ED),Traumatic,Moderate,Physical pain
gave birth to a stillborn child,Experienced Directly (ED),Traumatic,High,Health/Medical
played ping-pong,Experienced Directly (ED),Non-Traumatic,Low,Miscellaneous 
was sentenced to 20 years in prison,Experienced Directly (ED),Traumatic,High,Threat to social status or other identity
read an email from a coworker,Witnessed (W),Non-Traumatic,Low,Miscellaneous 
hallucinated during a psychotic episode,Experienced Directly (ED),Traumatic,High,Threat to moral identity
was bullied on social media,Experienced Directly (ED),Traumatic,High,Threat to social status or other identity
used a public drinking fountain,Experienced Directly (ED),Non-Traumatic,Low,Miscellaneous 
watched a video of a man being punched,Witnessed (W) ,Traumatic,Moderate,Physical pain
failed an exam,Experienced Directly (ED),Non-Traumatic,Low,Threat to social status or other identity
learned about a violent rape in a college course,Learned About (LA),Traumatic,Moderate,Sexual content
met a new acquaintance at a party,Experienced Directly (ED),Non-Traumatic,Low,Miscellaneous 
swept the floor,Experienced Directly (ED),Non-Traumatic,Low,Miscellaneous 
learned about a stranger moving to another country,Learned About (LA),Non-Traumatic,Low,Miscellaneous 
had their tongue cut out by a stranger,Experienced Directly (ED),Traumatic,High,Actual physical injury
received a diagnosis of schizophrenia,Experienced Directly (ED) ,Traumatic,High,Health/Medical 
attended trivia night at a bar,Experienced Directly (ED),Non-Traumatic,Low,Miscellaneous 
was slapped in the face by a romantic partner,Experienced Directly (ED),Traumatic,Moderate,Close interpersonal perpetrator 
climbed a tree,Experienced Directly (ED),Non-Traumatic,Low,Miscellaneous 
tied shoelaces,Experienced Directly (ED),Non-Traumatic,Low,Miscellaneous 
witnessed a daughter die in a vehicle accident,Witnessed (W),Traumatic,High,Close interpersonal victim
was touched in the crotch by a coworker without permission,Experienced Directly (ED),Traumatic,High,Sexual content
nearly drowned while playing water polo,Experienced Directly (ED),Traumatic,High,Threat of death
watched a video about car repair online,Witnessed (W),Non-Traumatic,Low,Miscellaneous 
had an emergency leg amputation without anesthesia,Experienced Directly (ED),Traumatic,High,Actual physical injury
witnessed a corpse after being hanged,Witnessed (W),Traumatic,High,Actual death
was kidnapped and held hostage,Experienced Directly (ED),Traumatic,High,Threat of death
gained 15 pounds,Experienced Directly (ED),Non-Traumatic,Low,Miscellaneous 
was forced to practice an instrument for several hours each day,Experienced Directly (ED),Traumatic,High,Threat to moral worldview
lost a leg unexpectedly while sedated in surgery,Experienced Directly (ED),Traumatic,High,Actual physical injury
was called a racial slur,Experienced Directly (ED),Traumatic,High,Threat to social status or other identity
was licked in the face by a dog,Experienced Directly (ED),Traumatic,Low,Miscellaneous 
lost a child during an earthquake,Experienced Directly (ED),Traumatic,High,Actual death
watched a video of a child being shot and killed,Witnessed (W) ,Traumatic,High,Actual death
studied for a quiz,Experienced Directly (ED),Non-Traumatic,Low,Miscellaneous 
talked with a therapist,Experienced Directly (ED),Non-Traumatic,Low,Miscellaneous 
witnessed a cow killed by a farmer,Witnessed (W),Traumatic,Moderate,Actual death
witnessed a child die by suicide,Witnessed (W),Traumatic,High,Actual death
went to an orthodontist appointment,Experienced Directly (ED),Non-Traumatic,Low,Health/Medical 
broke an arm falling down,Experienced Directly (ED),Traumatic,Moderate,Actual physical injury
talked on the phone with a mother,Experienced Directly (ED),Non-Traumatic,Low,Miscellaneous 
found a stranger's hair in soup,Experienced Directly (ED),Non-Traumatic,Low,Miscellaneous 
participated in an online research study,Experienced Directly (ED),Non-Traumatic,Low,Miscellaneous 
went to a routine checkup at the doctor,Experienced Directly (ED),Non-Traumatic,Low,Health/Medical
was caught in a storm in a commercial flight,Experienced Directly (ED),Traumatic,Moderate,Threat of physical injury
performed with a church choir,Experienced Directly (ED),Non-Traumatic,Low,Miscellaneous 
drank a glass of water,Experienced Directly (ED),Non-Traumatic,Low,Miscellaneous 
was kicked by a horse and broke a rib,Experienced Directly (ED),Traumatic,High,Actual physical injury
had a bad haircut,Experienced Directly (ED),Non-Traumatic,Low,Miscellaneous 
was raped by a family member,Experienced Directly (ED),Traumatic,High,Close interpersonal perpetrator
listened to a radio station,Experienced Directly (ED),Non-Traumatic,Low,Miscellaneous 
assembled a new piece of furniture,Experienced Directly (ED),Non-Traumatic,Low,Miscellaneous 
went bungee jumping,Experienced Directly (ED),Non-Traumatic,Low,Miscellaneous 
was disowned by a father,Experienced Directly (ED),Traumatic,High,Threat to trust in interpersonal relationships
received a diagnosis of HIV/AIDs,Experienced Directly (ED),Traumatic,High,Health/Medical
had a blister on a foot,Experienced Directly (ED),Non-Traumatic,Low,Physical pain
chopped wood using a hatchet,Experienced Directly (ED),Non-Traumatic,Low,Miscellaneous 
accidentally deleted an important computer file,Experienced Directly (ED),Non-Traumatic,Low,Threat to social status or other identity 
broke a vertebrae while practicing martial arts,Experienced Directly (ED),Traumatic,High,Actual physical injury
took a bus ride into the city,Experienced Directly (ED),Non-Traumatic,Low,Miscellaneous 
went out for ice cream,Experienced Directly (ED),Non-Traumatic,Low,Miscellaneous 
bumped into a stranger while walking,Experienced Directly (ED),Non-Traumatic,Low,Physical pain 
saw a shark at the aquarium,Experienced Directly (ED),Non-Traumatic,Low,Miscellaneous 
learned about the molestation of a child in a college course,Learned About (LA),Traumatic,Moderate,Sexual content
was attacked by a moose,Experienced Directly (ED),Traumatic,High,Actual physical injury
witnessed a family member being hit by a car and killed,Witnessed (W),Traumatic,High,Actual death
planted a tree,Experienced Directly (ED),Non-Traumatic,Low,Miscellaneous 
was injured in an IED explosion,Experienced Directly (ED),Traumatic,High,Actual physical injury
smelled a trash can,Experienced Directly (ED),Non-Traumatic,Low,Miscellaneous 
vomited on an airplane,Experienced Directly (ED),Non-Traumatic,Low,Miscellaneous 
tripped and fell without injury,Experienced Directly (ED),Non-Traumatic,Low,Physical pain
bumped a shoulder against a doorway,Experienced Directly (ED),Non-Traumatic,Low,Physical pain
witnessed a corpse that had died by gunshot, Witnessed (W),Traumatic,High,Actual death
played a board game with friends,Experienced Directly (ED),Non-Traumatic,Low,Miscellaneous 
was yelled at by a political protest,Experienced Directly (ED),Non-Traumatic,Low,Threat to social status or other identity 
had face painted at a county fair,Experienced Directly (ED),Non-Traumatic,Low,Miscellaneous 
"as a nurse, witnessed an infant die in childbirth",Witnessed (W),Traumatic,High,Actual death
"made an error as a doctor, resulting in a patient's death",Experienced Directly (ED),Traumatic,High,Threat to moral identity
read a fashion magazine,Experienced Directly (ED),Non-Traumatic,Low,Miscellaneous 
was asked by a doctor to report sexual activity,Experienced Directly (ED),Traumatic,Moderate,Sexual content
was drafted in a war he/she did not believe in,Experienced Directly (ED),Non-Traumatic,High,Threat to moral worldview
failed out of medical school,Experienced Directly (ED),Traumatic,Moderate,Threat to social status or other identity
changed the oil in a car,Experienced Directly (ED),Non-Traumatic,Low,Miscellaneous
had a glass of wine,Experienced Directly (ED),Non-Traumatic,Low,Miscellaneous
started a campfire,Experienced Directly (ED),Non-Traumatic,Low,Miscellaneous
witnessed a child choke on a piece of plastic,Witnessed (W),Traumatic,Moderate,Threat of death
lost several toes due to frostbite,Experienced Directly (ED),Traumatic,High,Physical pain
opened the curtains in the living room,Experienced Directly (ED),Non-Traumatic,Low,Miscellaneous
completely lost vision after a workplace chemical accident,Experienced Directly (ED),Traumatic,High,Actual physical injury
fell unconscious due to diabetic complications,Experienced Directly (ED),Traumatic,Moderate,Health/Medical
watched a video of a football injury,Witnessed (W) ,Non-Traumatic,Low,Actual physical injury
was told he/she was worthless by a parent,Experienced Directly (ED),Traumatic,High,Threat to social status or other identity
went into a haunted house,Experienced Directly (ED),Non-Traumatic,Low,Miscellaneous
learned about ritualistic child sexual abuse and murder,Learned About (LA),Traumatic,High,Sexual content
accidentally killed an innocent during warfare,Experienced Directly (ED),Traumatic,High,Threat to moral identity
was molested by a father,Experienced Directly (ED),Traumatic,High,Close interpersonal perpetrator
read newspaper coverage of a terrorist attack,Learned About (LA) ,Traumatic,Moderate,Threat to moral worldview
walked down a set of steep stairs,Experienced Directly (ED),Non-Traumatic,Low,Miscellaneous
moved across the country,Experienced Directly (ED),Non-Traumatic,Low,Threat to social status or other identity
tried a new food and found it disgusting,Experienced Directly (ED),Non-Traumatic,Low,Miscellaneous
nearly suffocated due to an asthma attack,Experienced Directly (ED),Traumatic,High,Threat of death
hitchhiked to a different city,Experienced Directly (ED),Non-Traumatic,Low,Miscellaneous
watched a video of a man being killed by a bear,Witnessed (W),Traumatic,High,Actual death
was choked by a stranger,Experienced Directly (ED),Traumatic,High,Human perpetrator
witnessed a man listening to music,Witnessed (W),Non-Traumatic,Low,Miscellaneous
debated with a friend about politics,Experienced Directly (ED),Non-Traumatic,Low,Miscellaneous
witnessed a cat being hit by a car and killed,Witnessed (W),Traumatic,High,Actual death
had an abortion after being pressured by a partner,Experienced Directly (ED),Traumatic,High,Threat to trust in interpersonal relationships
had an abortion after being pressured by family,Experienced Directly (ED),Traumatic,High,Threat to trust in interpersonal relationships
accidentally used a family member's towel,Experienced Directly (ED),Non-Traumatic,Low,Accident
was electrocuted by a power cable in a workplace accident,Experienced Directly (ED),Traumatic,High,Actual physical injury
watched a video of a man breaking his spine,Witnessed (W),Traumatic,High,Actual physical injury
was evacuated during a tsunami,Experienced Directly (ED),Traumatic,High,Threat of death
was beaten by police following a nonviolent crime,Experienced Directly (ED),Traumatic,High,Human perpetrator
rode a zipline while on a vacation,Experienced Directly (ED),Non-Traumatic,Low,Miscellaneous
played a horror video game,Experienced Directly (ED),Non-Traumatic,Low,Miscellaneous
"made an error as a surgeon, resulting in a patient's death",Experienced Directly (ED),Traumatic,High,Actual death
lost all life savings due to fraud,Experienced Directly (ED),Traumatic,High,Loss of possessions
wrote a 3-page essay,Experienced Directly (ED),Non-Traumatic,Low,Miscellaneous
witnessed a romantic partner being forcibly arrested,Witnessed (W),Traumatic,Moderate,Close interpersonal perpetrator
used a payphone to contact a family member,Experienced Directly (ED),Non-Traumatic,Low,Miscellaneous
learned about a friend going to the store,Learned About (LA),Non-Traumatic,Low,Miscellaneous
went to a rock concert,Experienced Directly (ED),Non-Traumatic,Low,Miscellaneous
family cat ran away,Experienced Directly (ED),Traumatic,Moderate,Loss of possessions
had ears pierced,Experienced Directly (ED),Non-Traumatic,Low,Miscellaneous
watched a heated political debate,Witnessed (W) ,Non-Traumatic,Low,Threat to moral worldview
"as a doctor, witnessed a patient die",Witnessed (W),Traumatic,High,Actual death
had a painful tooth cavity,Experienced Directly (ED),Non-Traumatic,Moderate,Physical pain
played a video game,Experienced Directly (ED),Non-Traumatic,Low,Miscellaneous
was injured in a motorcycle accident,Experienced Directly (ED),Traumatic,High,Actual physical injury
was embarrassed by own behavior while drunk,Experienced Directly (ED),Traumatic,High,Threat to moral identity
listened to an audio tape of a stranger being raped,Experienced Directly (ED),Traumatic,High,Sexual content
was weighed at the doctor's office,Experienced Directly (ED),Non-Traumatic,Low,Miscellaneous
ran out of gas while driving on the highway,Experienced Directly (ED),Non-Traumatic,Moderate,Miscellaneous
lost a family member in an earthquake,Experienced Directly (ED),Traumatic,High,Actual death
received a diagnosis of Alzheimer's disease,Experienced Directly (ED),Traumatic,High,Threat to moral identity
read a book in which an adult was injured in an explosion,Learned About (LA) ,Non-Traumatic,Moderate,Actual physical injury
testified against a family member in a criminal trial,Experienced Directly (ED),Traumatic,High,Threat to trust in interpersonal relationships
had a pedicure,Experienced Directly (ED),Non-Traumatic,Low,Miscellaneous
learned about a family member being killed in a terrorist attack,Learned About (LA),Traumatic,High,Actual death
walked across a narrow walkway in a ropes course,Experienced Directly (ED),Non-Traumatic,Low,Miscellaneous
looked at an old family photo album,Witnessed (W) ,Non-Traumatic,Low,Miscellaneous
contracted athlete's foot,Experienced Directly (ED),Traumatic,High,Health/Medical
was kept for a month in solitary confinement,Experienced Directly (ED),Traumatic,High,Threat to social status or other identity
went to a chiropractor appointment,Experienced Directly (ED),Non-Traumatic,Low,Health/Medical
witnessed a family member die by heart attack,Witnessed (W),Traumatic,High,Actual death
was told he/she was stupid by a teacher,Experienced Directly (ED),Traumatic,Moderate,Threat to moral identity 
was robbed while sleeping,Experienced Directly (ED),Traumatic,High,Human perpetrator
was sick with the flu,Experienced Directly (ED),Non-Traumatic,Moderate,Health/Medical
"as a doctor, witnessed an infant die in childbirth",Witnessed (W),Traumatic,High,Actual death
lost internet connection during an important video call,Experienced Directly (ED),Non-Traumatic,Low,Miscellaneous
discovered a raccoon in a backyard,Experienced Directly (ED),Non-Traumatic,Low,Miscellaneous
was verbally threatened with rape,Experienced Directly (ED),Traumatic,High,Sexual content
debated with a family member about politics,Experienced Directly (ED),Non-Traumatic,Low,Threat to trust in interpersonal relationships
went to a dentist appointment,Experienced Directly (ED),Non-Traumatic,Low,Health/Medical
had a miscarriage during the first trimester,Experienced Directly (ED),Traumatic,High,Actual death
witnessed a stranger being shot and killed,Witnessed (W),Traumatic,High,Actual death
was spat on by a stranger,Experienced Directly (ED),Traumatic,Moderate,Threat to moral worldview
witnessed a friend being teased at school,Witnessed (W),Traumatic,Moderate,Threat to social status or other identity
attended an academic lecture he/she disagreed with,Experienced Directly (ED),Non-Traumatic,Low,Threat to moral worldview
walked up a hill,Experienced Directly (ED),Non-Traumatic,Low,Miscellaneous 
broke a leg in a bicycle accident,Experienced Directly (ED),Traumatic,High,Actual physical injury
was attacked by a bear,Experienced Directly (ED),Traumatic,High,Threat of death
watched a pornographic film,Witnessed (W) ,Non-Traumatic,Moderate,Sexual content
took a bike ride,Experienced Directly (ED),Non-Traumatic,Low,Miscellaneous
attempted suicide by poisoning but survived,Experienced Directly (ED),Traumatic,High,Threat of death
was punched in the arm by a friend,Experienced Directly (ED),Non-Traumatic,Low,Physical pain
was caught in a riptide and nearly drowned,Experienced Directly (ED),Traumatic,High,Threat of death
fell off of a slackline without injury,Experienced Directly (ED),Traumatic,Moderate,Threat of physical injury
witnessed a dog being hit by a car and killed,Witnessed (W),Traumatic,High,Actual death
lost control of his/her bladder in a public place,Experienced Directly (ED),Traumatic,High,Threat to social status or other identity
sat on the beach,Experienced Directly (ED),Non-Traumatic,Low,Miscellaneous
witnessed a stranger die by jumping off of a bridge,Witnessed (W),Traumatic,High,Actual death
broke a vertebrae by falling while rock-climbing,Experienced Directly (ED),Traumatic,High,Actual physical injury
shot and killed an enemy during warfare,Experienced Directly (ED),Traumatic,High,Actual death
was fired from a job,Experienced Directly (ED),Non-Traumatic,Low,Miscellaneous
lost a home in an earthquake,Experienced Directly (ED),Traumatic,High,Loss of possessions
lost a favorite pen,Experienced Directly (ED),Non-Traumatic,Low,Loss of possessions
bought an item from a pawn shop,Experienced Directly (ED),Non-Traumatic,Low,Miscellaneous
visited a tourist location in another country,Experienced Directly (ED),Non-Traumatic,Low,Miscellaneous
was stabbed while working as a police officer,Experienced Directly (ED),Traumatic,High,Threat of death
had a face disfigured in a fire,Experienced Directly (ED),Traumatic,High,Actual physical injury
was stabbed by a family member,Experienced Directly (ED),Traumatic,High,Threat of death
watched a movie in which an individual was stabbed and killed,Witnessed (W) ,Traumatic,High,Actual death
lost data from a hard drive,Experienced Directly (ED),Non-Traumatic,Low,Miscellaneous
learned about a friend being killed in a terrorist attack,Learned About (LA),Non-Traumatic,High,Actual death
was ignored by a stranger,Experienced Directly (ED),Non-Traumatic,Low,Threat to moral worldview
witnessed a mother develop Alzheimer's disease,Witnessed (W),Traumatic,High,Close interpersonal victim
lost consciousness due to blood loss in a complicated childbirth delivery,Experienced Directly (ED),Traumatic,High,Threat of death
watched a game of baseball on TV,Witnessed (W) ,Non-Traumatic,Low,Miscellaneous
learned about the murder of a family member,Learned About (LA),Traumatic,High,Actual death
was falsely accused of abusing a daughter,Experienced Directly (ED),Traumatic,High,Threat to moral identity
was touched on the buttocks by a friend without permission,Experienced Directly (ED),Traumatic,Moderate,Threat to trust in interpersonal relationships
became trapped in a cave,Experienced Directly (ED),Traumatic,High,Threat of death
went skydiving,Experienced Directly (ED),Non-Traumatic,Low,Miscellaneous
broke an arm playing football,Experienced Directly (ED),Traumatic,High,Actual physical injury
was verbally harassed by a religious leader,Experienced Directly (ED),Traumatic,High,Threat to moral worldview
family dog ran away,Experienced Directly (ED),Traumatic,High,Loss of possessions
attended a dancing class,Experienced Directly (ED),Non-Traumatic,Low,Miscellaneous
watched a video of a man being beheaded,Witnessed (W),Traumatic,High,Actual death
read a political article with his/her same opinion,Experienced Directly (ED),Non-Traumatic,Low,Miscellaneous
was beaten until unconscious by a stranger,Experienced Directly (ED),Traumatic,High,Actual physical injury
lost a foot due to diabetic complications,Experienced Directly (ED),Traumatic,High,Actual physical injury
received a first tattoo,Experienced Directly (ED),Non-Traumatic,Low,Physical pain
went skiing,Experienced Directly (ED),Non-Traumatic,Low,Miscellaneous
cleaned trash off of the sidewalk,Experienced Directly (ED),Non-Traumatic,Low,Miscellaneous
was startled by gunfire at a shooting range,Experienced Directly (ED),Traumatic,High,Threat of physical injury
witnessed a stranger urinating in public,Witnessed (W),Non-Traumatic,Low,Threat to moral worldview
witnessed a friend die in a car accident,Witnessed (W),Traumatic,High,Actual death
was accused of rape on national TV,Experienced Directly (ED),Traumatic,High,Threat to social status or other identity
read newspaper coverage about genocide,Witnessed (W),Traumatic,Moderate,Threat to moral worldview
attended a yoga class,Experienced Directly (ED),Non-Traumatic,Low,Miscellaneous
was molested by a stranger,Experienced Directly (ED),Traumatic,High,Sexual content 
was arrested during a peaceful protest,Experienced Directly (ED),Traumatic,Moderate,Human perpetrator
was screamed at by a stranger,Experienced Directly (ED),Traumatic,Moderate,Human perpetrator
learned about a stranger being injured in an explosion,Learned About (LA),Traumatic,High,Actual physical injury
fixed a squeaky door,Experienced Directly (ED),Non-Traumatic,Low,Miscellaneous
was publicly scolded by a teacher,Experienced Directly (ED),Traumatic,Moderate,Human perpetrator
was embarrassed by walking into the wrong bathroom,Experienced Directly (ED),Non-Traumatic,Low,Threat to social status or other identity
visited the slums of a developing country,Experienced Directly (ED),Traumatic ,Moderate,Threat to moral worldview
attended a club meeting,Experienced Directly (ED),Non-Traumatic,Low,Miscellaneous
was pushed by a stranger,Experienced Directly (ED),Non-Traumatic,Low,Human perpetrator
played a virtual-reality horror video game,Experienced Directly (ED),Non-Traumatic,Low,Miscellaneous
bought groceries,Experienced Directly (ED),Non-Traumatic,Low,Miscellaneous
was grabbed by the throat by a stranger,Experienced Directly (ED),Traumatic,High,Human perpetrator
watched a preview for an upcoming blockbuster,Witnessed (W) ,Non-Traumatic,Low,Miscellaneous
listened to Beethoven's 5th symphony,Experienced Directly (ED),Non-Traumatic,Low,Miscellaneous
attended a picnic,Experienced Directly (ED),Non-Traumatic,Low,Miscellaneous
sent an email to a coworker,Experienced Directly (ED),Non-Traumatic,Low,Miscellaneous
saw a tarantula at the zoo,Witnessed (W),Non-Traumatic,Low,Miscellaneous
witnessed a son die in a bicycle accident,Witnessed (W),Traumatic,High,Actual death
smelled a bin of agricultural compost,Experienced Directly (ED),Non-Traumatic,Low,Miscellaneous
took a shower,Experienced Directly (ED),Non-Traumatic,Low,Miscellaneous
was sent to prison,Experienced Directly (ED),Traumatic,High,Threat to social status or other identity 
conversed with a friend via text message,Experienced Directly (ED),Non-Traumatic,Low,Miscellaneous
broke an arm while practicing martial arts,Experienced Directly (ED),Traumatic,High,Actual physical injury
became trapped while crawling through a tunnel,Experienced Directly (ED),Traumatic,High,Threat of physical injury
was punched by a friend,Experienced Directly (ED),Traumatic,Moderate,Close interpersonal perpetrator
was forced to eat an insect,Experienced Directly (ED),Traumatic,Moderate,Threat to moral worldview
had a cavity filled at the dentist's office,Experienced Directly (ED),Non-Traumatic,Low,Miscellaneous
accidentally shot and killed a friend at a shooting range,Experienced Directly (ED),Traumatic,High,Actual death
was cut and bruised in a motorcycle accident,Experienced Directly (ED),Traumatic,High,Actual physical injury
read a political cartoon,Learned About (LA) ,Non-Traumatic,Low,Miscellaneous
witnessed a friend faint,Witnessed (W) ,Traumatic ,Moderate,Threat of physical injury
lost control of his/her bowels in a public place,Experienced Directly (ED),Traumatic,High,Threat to social status or other identity
visited a scrapyard full of crashed vehicles,Experienced Directly (ED),Non-Traumatic,Low,Miscellaneous
witnessed a deer killed by a hunter,Witnessed (W),Traumatic,High,Actual death
